"Course number","Course title","Registration restrictions","Units","Type","Section","Session","Time","Days","Seats","Registered","Waitlist","Instructor","Room"
"GESM-110g","Seminar in the Arts","C","4.0 units"
"","Looking at Language","","4.0","Lecture","35290R","001","9:30-10:50am","Tue, Thu","2","0","0","Alice Gambrell","THH214"
"","Modern Russian Art","","4.0","Lecture","35291R","001","8:00-9:20am","Tue, Thu","2","0","0","John Bowlt","VKC255"
"","Scripture and Script: The Hebrew Bible in Modern Literature and Film","","4.0","Lecture","35292R","001","9:30-10:50am","Tue, Thu","2","0","0","Leah Hochman","LVL3Y"
"","World Arts, Cultures, and Empires","","4.0","Lecture","35293R","001","8:30-9:50am","Mon, Wed","2","0","0","Indra Mukhopadhyay","GFS228"
"","How to Tell Stories with Pictures","","4.0","Lecture","35294R","001","2:00-2:50pm","MWF","2","0","0","Hector Reyes","VKC209"
"","Designing Things for Kids","","4.0","Lecture","35295R","001","11:00-12:20pm","Tue, Thu","2","0","0","Amy Ogata","LVL3Y"
"","Soundscapes","","4.0","Lecture","35296R","001","12:00-12:50pm","MWF","2","0","0","Eric Rawson","VKC255"
"","Creating Art for Real Life","","4.0","Lecture","35297R","001","12:30-1:50pm","Tue, Thu","2","0","0","Michael Bunn","LVL3Y"
"","Classic and Contemporary Fairy Tales","","4.0","Lecture","35298R","001","1:00-1:50pm","MWF","2","0","0","Aimee Bender","VKC255"
"","Imitation of Life: Art in the Twentieth Century","","4.0","Lecture","35299R","001","2:00-3:20pm","Mon, Wed","2","0","0","Megan Luke","LVL3Y"
"","Medieval Art and Christian Ritual","","4.0","Lecture","35300R","001","2:00-3:20pm","Tue, Thu","2","0","0","Carolyn Malone","VKC200"
"","Making Paintings","","4.0","Lecture","35305R","001","10:00-11:50am","Mon, Wed","2","0","0","","HAR202"
"","Exile and Identity? Modern Israeli and Palestinian Artists","","4.0","Lecture","35306R","001","11:00-12:20pm","Tue, Thu","2","0","0","",""
"","The Modern Movement in Architecture","","4.0","Lecture","35307R","001","12:30-1:50pm","Tue, Thu","2","0","0","James Steele","WAHB1"
"","Intensive Survey: Prehistory to the Present","","4.0","Lecture","35308R","001","2:00-3:20pm","Mon, Wed","2","0","0","Kenneth Breisch","GFS228"
"","Photography, Art, and the Landscape","","4.0","Lecture","35309R","001","2:00-3:50pm","Mon, Wed","2","0","0","Caroline Clerc","WAH6"
"","L.A. Culture Behind the Scenes: Process Storytelling About Art and Entertainment","","4.0","Lecture","35310R","001","2:00-3:20pm","Tue, Thu","2","0","0","Sasha Anawalt","ANN209"
"","Masks, Puppets, and the Manipulation of the Human Form","","4.0","Lecture","35312R","001","9:30-10:50am","Tue, Thu","2","0","0","Christina Haatainen-Jones","PED114E"
"","Performing Revolutions: Global History of Theatre and Social Change","","4.0","Lecture","35313R","001","9:30-10:50am","Tue, Thu","2","0","0","Brent Blair","MCC102"
"","Eco-Theatre","","4.0","Lecture","35314R","001","10:30-11:50am","Tue, Thu","2","0","0","Paula Cizmar","DRC120"
"","The Actor ar Work","","4.0","Lecture","35315R","001","11:00-12:50pm","Tue, Thu","2","0","0","Sharon Carnicke, Mary-Joan Negro","MCC102"
"","The Theatre Scene","","4.0","Lecture","35317R","001","9:30-10:50am","Tue, Thu","2","0","0","Carla Della Gatta","LVL13"
"","Stages of Healing: The World of Theatre and Therapy","","4.0","Lecture","35318R","001","3:30-4:50pm","Tue, Thu","2","0","0","Brent Blair","MCC102"
"","Music as Material","","4.0","Lecture","35319D","001","10:00-11:50am","Tue, Thu","19","0","0","Lisa Vest","MUS213"
"","Jazz: America's Music","","4.0","Lecture","35321R","001","4:00-5:50pm","Mon, Wed","2","0","0","John Thomas","TMC G156"
"","Music and Performance Art","","4.0","Lecture","35322R","001","4:00-5:50pm","Mon, Wed","2","0","0","Veronika Krausas","UUC B3"
"","Pioneers of the Impossible: Poetry and Fiction Forging New Borders amd Boundaries","","4.0","Lecture","35323R","001","2:00-3:20pm","Mon, Wed","2","0","0","Mark Irwin","VKC254"
"GESM-120g","Seminar in Humanistic Inquiry","C","4.0 units"
"","Representing the Global War on Terror","","4.0","Lecture","35332R","001","9:30-10:50am","Tue, Thu","2","0","0","Alexander Young","THH106"
"","Trauma and Memory in Spanish and Latin American Cinema and Literature","","4.0","Lecture","35334R","001","9:30-10:50am","Tue, Thu","2","0","0","Julian Gutierrez-Albilla","VKC256"
"","The Uncanny in Medieval and Renaissance Europe","","4.0","Lecture","35337R","001","9:30-10:50am","Tue, Thu","2","0","0","Thea Tomaini","WPH206"
"","Time and Time Travel","","4.0","Lecture","35340R","001","11:00-11:50am","MWF","2","0","0","James Van Cleve","GFS228"
"","Being Black in Britain: 1500-2000","","4.0","Lecture","35341R","001","11:00-11:50am","MWF","2","0","0","Lindsay O'Neill","LVL3Y"
"","Epidemics and Disasters in History","","4.0","Lecture","35342R","001","11:00-12:20pm","Tue, Thu","2","0","0","Elinor Accampo","WPH103"
"","Representing the Holocaust","","4.0","Lecture","35343R","001","11:00-12:20pm","Tue, Thu","2","0","0","Sharon Gillerman","VKC258"
"","The Russian Novel","","4.0","Lecture","35344R","001","11:00-12:20pm","Tue, Thu","2","0","0","Greta Matzner-Gore","VKC252"
"","The Power of Stories: Tribal Identity in Contemporary America","","4.0","Lecture","35345R","001","11:00-12:20pm","Tue, Thu","2","0","0","Antonio Idini","VKC211"
"","The New Vietnam: Arts, Culture, Diaspora","","4.0","Lecture","35347R","001","11:00-12:20pm","Tue, Thu","2","0","0","Janet Hoskins","GFS229"
"","Tell Me a Story: American Novels that Made a Difference","","4.0","Lecture","35348R","001","11:00-12:20pm","Tue, Thu","2","0","0","Jessica Cantiello","GFS228"
"","Art and Text in Imperial Rome","","4.0","Lecture","35349R","001","11:00-12:20pm","Tue, Thu","2","0","0","Claudia Moatti","VPD107"
"","The Theater of Ancient Rome","","4.0","Lecture","35352R","001","12:30-1:50pm","Tue, Thu","2","0","0","Anthony Boyle","THH106"
"","Brazil and Its Others in Literature and Film","","4.0","Lecture","35353R","001","12:30-1:50pm","Tue, Thu","2","0","0","Brenno Kaneyasu Maranhao","LVL13"
"","Islam and the West","","4.0","Lecture","35354D","001","12:30-1:50pm","Tue, Thu","2","0","0","Olivia Harrison","VKC256"
"","Arabs and Turks: History and Theory","","4.0","Lecture","35355R","001","12:30-1:50pm","Tue, Thu","2","0","0","Veli Yashin","GFS229"
"","Southeast Asian Literature and Film","","4.0","Lecture","35356R","001","12:30-1:50pm","Tue, Thu","2","0","0","Brian Bernards","VKC200"
"","Ecstasy: The Forbidden Emotion","","4.0","Lecture","35357R","001","12:30-1:50pm","Tue, Thu","2","0","0","Mar Gomez Glez","VKC210"
"","The Story of the Chinese Language","","4.0","Lecture","35364R","001","2:00-3:20pm","Mon, Wed","2","0","0","Audrey Li","WPH206"
"","Modern Korean Literature and Thought","","4.0","Lecture","35365R","001","2:00-3:20pm","Mon, Wed","2","0","0","Sunyoung Park","WPH107"
"","Women in Literature and Film","","4.0","Lecture","35366R","001","2:00-3:20pm","Mon, Wed","2","0","0","Tania Modleski","VKC158"
"","Gender, Race and Knowledge","","4.0","Lecture","35367R","001","2:00-3:20pm","Mon, Wed","2","0","0","Bihui Li","VKC155"
"","On Beauty","","4.0","Lecture","35368R","001","2:00-3:20pm","Mon, Wed","2","0","0","Daniel Tiffany","VKC200"
"","Strangers and Strange Lands","","4.0","Lecture","35369R","001","2:00-3:20pm","Mon, Wed","2","0","0","Emily Zeamer","GFS229"
"","Race and Upward Mobility in U.S. Fiction and Media","","4.0","Lecture","35370R","001","2:00-3:20pm","Mon, Wed","2","0","0","Elda Roman","MRF206"
"","The New Frankenstein","","4.0","Lecture","35371R","001","2:00-3:20pm","Tue, Thu","2","0","0","Karina Eileraas","GFS228"
"","Eastern European Crime Stories: Legal Fiction from Crime to Punishment","","4.0","Lecture","35372R","001","2:00-3:20pm","Tue, Thu","2","0","0","Anna Krakus","VKC255"
"","Law, Language and Literature","","4.0","Lecture","35378R","001","2:00-3:20pm","Tue, Thu","2","0","0","Sandra Disner","GFS229"
"","Varieties of Love and Literary Form","","4.0","Lecture","35379R","001","3:30-4:50pm","Mon, Wed","2","0","0","Joseph Boone","VKC255"
"","On Beauty","","4.0","Lecture","35380R","001","3:30-4:50pm","Mon, Wed","2","0","0","Daniel Tiffany","VKC200"
"","Strangers and Strange Lands","","4.0","Lecture","35381R","001","3:30-4:50pm","Mon, Wed","2","0","0","Emily Zeamer","GFS229"
"","Protest and Revolt in French Literature and Film","","4.0","Lecture","35382R","001","3:30-4:50pm","Mon, Wed","2","0","0","Anna Rosensweig","GFS228"
"","Eastern European Crime Stories: Legal Fiction from Crime to Punishment","","4.0","Lecture","35384R","001","3:30-4:50pm","Tue, Thu","2","0","0","Anna Krakus","VKC255"
"","Poetry of Resistance","","4.0","Lecture","35385R","001","3:30-4:50pm","Tue, Thu","2","0","0","Beatrice Sanford","VKC200"
"","Human Reason: Its Scope and Limits","","4.0","Lecture","35386R","001","3:30-4:50pm","Tue, Thu","2","0","0","Janet Levin","GFS229"
"","Women Writing Diaspora","","4.0","Lecture","35387R","001","3:30-4:50pm","Tue, Thu","2","0","0","Karina Eileraas","GFS228"
"","The Cultural Politics of Broadway","","4.0","Lecture","35394R","001","3:30-4:50pm","Mon, Wed","2","0","0","David Roman","VKC254"
"","Mesiah: The History of Idea","","4.0","Lecture","35395R","001","3:30-4:50pm","Mon, Wed","2","0","0","Joshua Garroway","LVL3V"
"GESM-130g","Seminar in Social Analysis","C","4.0 units"
"","Introduction to Education: Examining Critical Issues","","4.0","Lecture","35425R","001","8:30-9:50am","Mon, Wed","2","0","0","Paula Carbone","VKC254"
"","Los Angeles as a City","","4.0","Lecture","35426R","001","8:00-9:20am","Tue, Thu","2","0","0","Martin Krieger","VKC254"
"","Music and Class in American Society","","4.0","Lecture","35427R","001","9:30-10:50am","Tue, Thu","2","0","0","","VKC255"
"","Mexican American Places in Literature and Film","","4.0","Lecture","35430R","001","11:00-12:20pm","Tue, Thu","2","0","0","Laura Pulido","VKC254"
"","Health, Humanity and the Healing Arts","","4.0","Lecture","35431R","001","11:00-12:20pm","Tue, Thu","2","0","0","Robert Chernoff","VKC255"
"","Language, Race and Identity in the United States Today","","4.0","Lecture","35432R","001","12:30-1:50pm","Tue, Thu","2","0","0","Sarah Benor","VKC255"
"","Gender, Sexual Orientation and Families","","4.0","Lecture","35433D","001","2:00-3:20pm","Mon, Wed","19","0","0","Tim Biblarz","OFFICE"
"","Infrastructure, Energy, and Society","","4.0","Lecture","35434R","001","2:00-3:20pm","Mon, Wed","2","0","0","Edward Maby","VKC157"
"","Introduction to Educational Inquiry through the Study of Inequities in Education","","4.0","Lecture","35435R","001","2:00-3:20pm","Tue, Thu","2","0","0","Briana Hinga","WPH B30"
"","Education and Social Justice","","4.0","Lecture","35436R","001","2:00-3:20pm","Tue, Thu","2","0","0","Lynne Goldfarb","WPH205"
"","The Health Populations: Epidemics and Their Causes","","4.0","Lecture","35441R","001","12:30-1:50pm","Tue, Thu","2","0","0","Jonathan Samet","VPD107"
"","Social Analysis of Mexican Immigration","","4.0","Lecture","35442R","001","12:30-1:50pm","Tue, Thu","2","0","0","Pierrette Hondagneu-Sotelo","GFS228"
"","Ethnography at Work: Anthropology and the Corporate Encounter","","4.0","Lecture","35443R","001","6:30-7:50pm","Mon, Wed","2","0","0","Jennifer Cool","GFS204"
"GESM-140g","Seminar in the Life Sciences","C","4.0 units"
"","The Physics of Life","","4.0","Lecture","35464R","001","2:00-3:20pm","Tue, Thu","2","0","0","James Boedicker","WPH B36"
"","Language and the Age of Internet","","4.0","Lecture","35465R","001","12:30-1:50pm","Tue, Thu","2","0","0","Elsi Kaiser","VKC254"
"","The Mind and Body Connection Through the Lifespan","","4.0","Lecture","35466R","001","5:00-6:30pm","Mon, Wed","2","0","0","Aaron Hagedorn","GER224"
"","Personality Across the Life Span","","4.0","Lecture","35467R","001","5:00-6:30pm","Tue, Thu","2","0","0","Aaron Hagedorn","GER224"
"GESM-160g","Seminar in Quantitative Reasoning","C","4.0 units"
"","Elementary Mathematics for Teaching","","4.0","Lecture","35483R","001","9:30-10:50am","Tue, Thu","2","0","0","Cymra Haskell","LVL3V"
"","Science as Dectective Work","","4.0","Lecture","35486R","001","2:00-3:20pm","Mon, Wed","2","0","0","Deborah Natoli","LVL3V"
"","Numbers and Narrative in Community","","4.0","Lecture","35487R","001","2:00-3:20pm","Tue, Thu","2","0","0","Lavonna Lewis","LVL3V"
"","Technologies that Change the World","","4.0","Lecture","35489R","001","3:30-4:50pm","Tue, Thu","2","0","0","Michelle Povinelli","LVL3V"
"","Mind, Belief and Behavior: Learning about Learning","","4.0","Lecture","35491R","001","2:00-3:20pm","Tue, Thu","2","0","0","Patricia Tobey","OFFICE"
